{
  "schema_version": "argus.experiment_run.v1alpha1",
  "experiment_run_id": "experiment-run-example-1",
  "experiment_revision": "experiment-revision-1",
  "baseline_evaluation_run_id": "evaluation-baseline-1",
  "variant_evaluation_run_id": "evaluation-variant-1",
  "evaluator_revision": "defect-presence-1",
  "variable": "prompt",
  "comparisons": [
    {
      "case_id": "case-example-1",
      "case_type": "positive_localized",
      "label_revision": 1,
      "baseline_review_run_id": "review-baseline-1",
      "variant_review_run_id": "review-variant-1",
      "baseline_review_run_ref": {
        "uri": "artifact://local/sha256/aaaaaaaaaaaaaaaaaaaaaaaaaaaaaaaaaaaaaaaaaaaaaaaaaaaaaaaaaaaaaaaa",
        "sha256": "aaaaaaaaaaaaaaaaaaaaaaaaaaaaaaaaaaaaaaaaaaaaaaaaaaaaaaaaaaaaaaaa",
        "size_bytes": 1024,
        "contract": "argus.review_run.v1alpha1"
      },
      "variant_review_run_ref": {
        "uri": "artifact://local/sha256/bbbbbbbbbbbbbbbbbbbbbbbbbbbbbbbbbbbbbbbbbbbbbbbbbbbbbbbbbbbbbbbb",
        "sha256": "bbbbbbbbbbbbbbbbbbbbbbbbbbbbbbbbbbbbbbbbbbbbbbbbbbbbbbbbbbbbbbbb",
        "size_bytes": 1024,
        "contract": "argus.review_run.v1alpha1"
      },
      "replay_change_set_ref": {
        "uri": "artifact://local/sha256/dddddddddddddddddddddddddddddddddddddddddddddddddddddddddddddddd",
        "sha256": "dddddddddddddddddddddddddddddddddddddddddddddddddddddddddddddddd",
        "size_bytes": 512,
        "contract": "argus.replay_change_set.v1alpha1"
      },
      "baseline_config_sha256": "eeeeeeeeeeeeeeeeeeeeeeeeeeeeeeeeeeeeeeeeeeeeeeeeeeeeeeeeeeeeeeee",
      "variant_config_sha256": "ffffffffffffffffffffffffffffffffffffffffffffffffffffffffffffffff",
      "baseline_duration_ms": 1200,
      "variant_duration_ms": 900,
      "latency_delta_ms": -300,
      "latency_authority": "review_run_stage_attempts",
      "expected_anchor_count": 1,
      "baseline_matched_anchor_count": 0,
      "variant_matched_anchor_count": 1,
      "matched_anchor_delta": 1,
      "baseline_localization": { "available": true },
      "variant_localization": { "available": true },
      "localization": { "available": true },
      "expected_suppression_count": 0,
      "baseline_observed_suppressions": 0,
      "variant_observed_suppressions": 0,
      "baseline_suppressed_targets": 0,
      "variant_suppressed_targets": 0,
      "suppressed_target_delta": 0,
      "baseline_escaped_targets": 0,
      "variant_escaped_targets": 0,
      "escaped_target_delta": 0,
      "baseline_inconclusive_targets": 0,
      "variant_inconclusive_targets": 0,
      "baseline_filter_efficacy": { "available": false, "reason_code": "structured_suppression_truth_unavailable" },
      "variant_filter_efficacy": { "available": false, "reason_code": "structured_suppression_truth_unavailable" },
      "filter_efficacy": { "available": false, "reason_code": "paired_filter_efficacy_unavailable" },
      "baseline_apply_checks_passed": 0,
      "variant_apply_checks_passed": 0,
      "apply_checks_passed_delta": 0,
      "baseline_apply_checks_failed": 0,
      "variant_apply_checks_failed": 0,
      "apply_checks_failed_delta": 0,
      "baseline_apply_authority": "unavailable",
      "variant_apply_authority": "unavailable",
      "baseline_apply_fidelity": { "available": false, "reason_code": "metric_not_applicable" },
      "variant_apply_fidelity": { "available": false, "reason_code": "metric_not_applicable" },
      "apply_fidelity": { "available": false, "reason_code": "paired_apply_fidelity_unavailable" },
      "baseline_usage_authority": "unavailable",
      "variant_usage_authority": "unavailable",
      "baseline_usage": { "available": false, "reason_code": "usage_receipt_artifact_unavailable" },
      "variant_usage": { "available": false, "reason_code": "usage_receipt_artifact_unavailable" },
      "usage": { "available": false, "reason_code": "paired_usage_unavailable" },
      "baseline_input_tokens": 0,
      "variant_input_tokens": 0,
      "input_token_delta": 0,
      "baseline_output_tokens": 0,
      "variant_output_tokens": 0,
      "output_token_delta": 0,
      "baseline_total_tokens": 0,
      "variant_total_tokens": 0,
      "total_token_delta": 0,
      "baseline_verdict": "fail",
      "variant_verdict": "pass",
      "transition": "improved",
      "reason_code": "quality_verdict_improved",
      "dimensions": []
    }
  ],
  "summary": {
    "cases": 1,
    "improved": 1,
    "regressed": 0,
    "unchanged": 0,
    "inconclusive": 0,
    "pass_delta": 1,
    "fail_delta": -1
  },
  "quality": { "available": true },
  "cost": { "available": false, "reason_code": "authoritative_billing_unavailable" },
  "usage": { "available": false, "reason_code": "paired_usage_unavailable" },
  "latency": { "available": true },
  "instability": { "available": false, "reason_code": "repeated_run_sample_unavailable" },
  "created_at": "2026-08-25T09:00:00Z",
  "recorded_at": "2026-08-25T09:01:00Z",
  "recorded_by": "evaluation-runner"
}
